{
  "name": "secure-auth-service",
  "dockerComposeFile": ["docker-compose.yml"],
  "service": "web",
  "workspaceFolder": "/app",
  "shutdownAction": "stopCompose",
  "customizations": {
    "vscode": {
      "extensions": [
        "ms-python.python",
        "ms-python.vscode-pylance",
        "ms-azuretools.vscode-docker",
        "ms-ossdata.vscode-postgresql"
      ],
      "settings": {
        "terminal.integrated.defaultProfile.linux": "bash",
        "python.defaultInterpreterPath": "/usr/local/bin/python"
      }
    }
  },
  "postCreateCommand": "pip install --upgrade pip && pip install --no-cache-dir -r requirements.txt",
  "remoteUser": "vscode",
  "forwardPorts": [8000],
  "portsAttributes": {
    "8000": {
      "label": "FastAPI App"
    },
    "5432": {
      "label": "PostgreSQL Database"
    }
  }
}
